{"schemaVersion":1,"artifactType":"report-plan","generatedAt":"2026-08-19T10:00:00Z","expiresAt":"2026-08-19T10:30:00Z","planId":"report-plan-20260819-001","planSha256":"9f7dcba93338d1d1957fb8472c6ab436ccd02434bd5837f34570e0a75279075c","projectRoot":"C:\\projects\\example","profileId":"profile-0123456789abcdef","property":"properties/200","request":{"requestId":"report-request-001","contentSha256":"abc"},"metadata":{"contentSha256":"aaaaaaaaaaaaaaaaaaaaaaaaaaaaaaaaaaaaaaaaaaaaaaaaaaaaaaaaaaaaaaaa","requestId":"request-1","discoveryRevision":"20260817","dimensions":["date"],"metrics":["activeUsers"]},"propertyContext":{"timeZone":"UTC","currencyCode":"USD","baselineRef":null,"measurementPlanRef":null,"qualityTier":"descriptive","language":"en"},"periods":[{"label":"current","from":"2026-07-22","to":"2026-08-18","complete":true}],"queries":[{"queryId":"query-overview","preset":"overview","operationId":"data.report.run","apiChannel":"v1beta","payload":{"metrics":[{"name":"activeUsers"}],"returnPropertyQuota":true},"maxPages":1,"maxRows":250,"compatibility":"compatible"}],"blockers":[],"limitations":[],"networkUsed":true,"mutationPerformed":false}
